{
  "deck_key": "ola",
  "status": "pass",
  "generated_at": "2026-06-21T14:42:14.911471Z",
  "checks": [
    {
      "name": "editing_mode",
      "status": "pass",
      "details": "slides_api_only"
    },
    {
      "name": "slide_count_positive",
      "status": "pass",
      "details": "declared=11 actual=11"
    },
    {
      "name": "object_inventory",
      "status": "pass",
      "details": "full_inventory_pulled"
    },
    {
      "name": "image_provenance_required",
      "status": "pass",
      "details": ""
    }
  ],
  "artifacts": [
    "/Users/jaideep/navier-atlas/deck-studio/decks/ola/deck.config.json",
    "/Users/jaideep/navier-atlas/deck-studio/decks/ola/slide-manifest.json",
    "/Users/jaideep/navier-atlas/deck-studio/decks/ola/image-manifest.json"
  ]
}
