{
  "deck_key": "uber-india",
  "status": "pass",
  "generated_at": "2026-06-21T14:35:58.326246Z",
  "checks": [
    {
      "name": "editing_mode",
      "status": "pass",
      "details": "slides_api_only"
    },
    {
      "name": "slide_count_positive",
      "status": "pass",
      "details": "declared=23 actual=23"
    },
    {
      "name": "object_inventory",
      "status": "pass",
      "details": "full_inventory_pulled"
    },
    {
      "name": "image_provenance_required",
      "status": "pass",
      "details": ""
    }
  ],
  "artifacts": [
    "decks/uber-india/deck.config.json",
    "decks/uber-india/slide-manifest.json",
    "decks/uber-india/image-manifest.json"
  ]
}
